set sequoiadb_debug_log=on;
drop table if exists in_pushdown_sequoiadb24927;
create table in_pushdown_sequoiadb24927 (a int, b int, c int, key(b))engine=sequoiadb;
insert into in_pushdown_sequoiadb24927 values(1,3,2),(2,1,1),(3,3,4),(4,2,4),(5,3,5);
insert into in_pushdown_sequoiadb24927 values(1,3,2),(2,1,1),(3,3,4),(4,2,4),(5,3,5);
insert into in_pushdown_sequoiadb24927 values(1,4,2),(2,5,1),(3,6,4),(4,5,4),(5,4,5);
insert into in_pushdown_sequoiadb24927 values(1,4,2),(2,5,1),(3,6,4),(4,5,4),(5,4,5);
select * from in_pushdown_sequoiadb24927 order by a,b,c;
a	b	c
1	3	2
1	3	2
1	4	2
1	4	2
2	1	1
2	1	1
2	5	1
2	5	1
3	3	4
3	3	4
3	6	4
3	6	4
4	2	4
4	2	4
4	5	4
4	5	4
5	3	5
5	3	5
5	4	5
5	4	5
select count(1) from in_pushdown_sequoiadb24927 where a in (1,2,3);
count(1)
12
select count(1) from in_pushdown_sequoiadb24927 where b in (1,2,3);
count(1)
10
update in_pushdown_sequoiadb24927 set a = 2 where a in (1,2,3);
select * from in_pushdown_sequoiadb24927 order by a,b,c;
a	b	c
2	1	1
2	1	1
2	3	2
2	3	2
2	3	4
2	3	4
2	4	2
2	4	2
2	5	1
2	5	1
2	6	4
2	6	4
4	2	4
4	2	4
4	5	4
4	5	4
5	3	5
5	3	5
5	4	5
5	4	5
update in_pushdown_sequoiadb24927 set b = 2 where a in (1,2,3);
select * from in_pushdown_sequoiadb24927 order by a,b,c;
a	b	c
2	2	1
2	2	1
2	2	1
2	2	1
2	2	2
2	2	2
2	2	2
2	2	2
2	2	4
2	2	4
2	2	4
2	2	4
4	2	4
4	2	4
4	5	4
4	5	4
5	3	5
5	3	5
5	4	5
5	4	5
delete from in_pushdown_sequoiadb24927 where a in (1,2,3);
select * from in_pushdown_sequoiadb24927 order by a,b,c;
a	b	c
4	2	4
4	2	4
4	5	4
4	5	4
5	3	5
5	3	5
5	4	5
5	4	5
delete from in_pushdown_sequoiadb24927 where b in (1,2,3);
select * from in_pushdown_sequoiadb24927 order by a,b,c;
a	b	c
4	5	4
4	5	4
5	4	5
5	4	5
drop table in_pushdown_sequoiadb24927;
set sequoiadb_debug_log=default;
